{
  "command": "python3 benchmark/results/collect.py",
  "data_provenance": "fully synthetic contig (benchmark/synthetic_axes/gen.py)",
  "generated_utc": "2026-10-07T12:40:53+00:00",
  "metrics": {
    "axes_checked": [
      "short_read",
      "variant",
      "mapping"
    ],
    "bam": {
      "A": "NOVEL_CONFIRMED",
      "B": "ARTIFACT",
      "C": "ARTIFACT",
      "D": "ARTIFACT"
    },
    "base": {
      "A": "NOVEL_CONFIRMED",
      "B": "ARTIFACT",
      "C": "UNCONFIRMED",
      "D": "ARTIFACT"
    },
    "n_per_category": 10,
    "samtools_used": true,
    "variant": {
      "A": "NOVEL_CONFIRMED",
      "B": "ARTIFACT",
      "C": "UNCONFIRMED",
      "D": "REFERENCE_BIAS"
    }
  },
  "notes": "Self-contained correctness check; regenerated and drift-checked by collect.py.",
  "protocol": "synthetic_axes",
  "ruleset_version": "builtin-0.0.6",
  "scope": "ci_fixture",
  "source": null,
  "status": "tracked",
  "tool_version": "0.0.7"
}
