{
  "command": "panisoguard adjudicate --classification flair_classification.txt --isoforms-gtf flair.isoforms.gtf --ref-gtf chr22_modified.gtf --sj-tab truth.SJ.tab --bam aln.bam [--config cfg_off.toml]; benchmark/bam_axis/score_bam_axis.py --off OFF --on ON",
  "data_provenance": "SQANTI-SIM GENCODE v49 chr22 (simulated PBSIM3 HiFi, one shared minimap2 splice:hq alignment); FLAIR collapse + SQANTI3. Public/simulated, no private data. OFF = current binary with mapping indel/softclip thresholds set > 1.0 (never fire); ON = shipped default config.",
  "metrics": {
    "discrimination_indel_near": {
      "false": {
        "frac_gt_threshold": 0.1129,
        "mean": 0.1289,
        "n": 124
      },
      "false_caught": 14,
      "genuine": {
        "max": 0.1905,
        "mean": 0.0316,
        "n": 430
      },
      "genuine_flagged": 0,
      "precision_at_threshold": 1.0,
      "threshold": 0.5
    },
    "impact": {
      "false_specificity_off": 0.9662,
      "false_specificity_on": 0.9662,
      "false_transitions_off_to_on": {
        "UNCONFIRMED->ARTIFACT": 9
      },
      "genuine_lost_from_confident_novel": 0,
      "genuine_sensitivity_off": 0.7822,
      "genuine_sensitivity_on": 0.7822
    }
  },
  "notes": "BAM read-level mapping axis: the indel-near / soft-clip fractions were measured by the BAM reader but never fed the verdict before v0.0.4. indel_near cleanly separates genuine (max 0.190) from false (mean 0.350) novel junctions; wiring it as a 4th mapping-artifact trigger (default frac > 0.5) catches false novel junctions at 100% precision (genuine max 0.190 < 0.5, so 0 genuine are ever flagged). Since the PARTIAL-never-promotes fix the 3 false novels it used to demote are already non-confident, so it no longer changes operating-point specificity here (ON == OFF); it relabels 9 false novels (UNCONFIRMED -> ARTIFACT) with an explicit mapping mechanism. Since 0.0.6 a junction feeds the gate only with >= min_spanning (3) reads, which is why fewer are caught than the 41/124 reported for 0.0.4. Soft-clip is ~0 on clean HiFi (data-dependent yield); it is wired as the same mapping mechanism for noisy reads but its yield is not claimed on this set.",
  "protocol": "bam_axis",
  "ruleset_version": "default-0.0.5",
  "scope": "gencode_v49_chr22_flair",
  "status": "tracked",
  "tool_version": "0.0.6"
}