{
  "command": "bash benchmark/sqanti3_filter_h2h/run.sh (after benchmark/sqanti_sim/run.sh); benchmark/sqanti3_filter_h2h/emit_metrics.py <work> <h2h> --emit-metrics ...; bootstrap CIs: 2000 resamples of the non-FSM isoforms, seed 1",
  "data_provenance": "SQANTI-SIM GENCODE v49 chr22 truth set of benchmark/sqanti_sim (FLAIR + SQANTI3 6.0.1); non-FSM multi-exon isoforms, 730 genuine / 140 false. Short reads: none, the oracle truth SJ.tab, or wgsim 2x100 pairs (250k/1M/4M) from the simulated transcripts weighted by long-read counts -> STAR 2.7.4a 2-pass. Public/simulated.",
  "generated_utc": "2026-10-19T12:17:43Z",
  "metrics": {
    "bootstrap_auprc_diff_vs_SQ3rules_95ci_no_short_reads": {
      "PIG": [
        -0.105,
        -0.066
      ],
      "PIG+bam": [
        0.029,
        0.061
      ]
    },
    "bootstrap_auprc_diff_vs_allSJ3_95ci": {
      "oracle": {
        "PIG": [
          -0.015,
          0.005
        ],
        "PIG+bam": [
          -0.009,
          0.011
        ]
      },
      "sr_1000000": {
        "PIG": [
          -0.01,
          0.01
        ],
        "PIG+bam": [
          -0.004,
          0.016
        ]
      },
      "sr_250000": {
        "PIG": [
          -0.008,
          0.013
        ],
        "PIG+bam": [
          -0.002,
          0.019
        ]
      },
      "sr_4000000": {
        "PIG": [
          -0.01,
          0.01
        ],
        "PIG+bam": [
          -0.004,
          0.016
        ]
      }
    },
    "none": {
      "PIG": {
        "FP": 0,
        "TP": 0,
        "auprc": 0.824,
        "coverage": 0.0,
        "f1": null,
        "prec": null,
        "rec": 0.0,
        "selective_risk": null,
        "spec": 1.0
      },
      "PIG+bam": {
        "FP": 4,
        "TP": 546,
        "auprc": 0.953,
        "coverage": 0.632,
        "f1": 0.853,
        "prec": 0.993,
        "rec": 0.748,
        "selective_risk": 0.007,
        "spec": 0.971
      },
      "SQ3ml": {
        "FP": 33,
        "TP": 202,
        "auprc": 0.829,
        "coverage": 1.0,
        "f1": 0.419,
        "prec": 0.86,
        "rec": 0.277,
        "selective_risk": 0.645,
        "spec": 0.764
      },
      "SQ3rules": {
        "FP": 58,
        "TP": 647,
        "auprc": 0.909,
        "coverage": 1.0,
        "f1": 0.902,
        "prec": 0.918,
        "rec": 0.886,
        "selective_risk": 0.162,
        "spec": 0.586
      }
    },
    "oracle": {
      "PIG": {
        "FP": 5,
        "TP": 430,
        "auprc": 0.971,
        "coverage": 0.578,
        "f1": 0.738,
        "prec": 0.989,
        "rec": 0.589,
        "selective_risk": 0.01,
        "spec": 0.964
      },
      "PIG+bam": {
        "FP": 5,
        "TP": 571,
        "auprc": 0.977,
        "coverage": 0.759,
        "f1": 0.874,
        "prec": 0.991,
        "rec": 0.782,
        "selective_risk": 0.008,
        "spec": 0.964
      },
      "SQ3ml": {
        "FP": 15,
        "TP": 235,
        "auprc": 0.924,
        "coverage": 1.0,
        "f1": 0.48,
        "prec": 0.94,
        "rec": 0.322,
        "selective_risk": 0.586,
        "spec": 0.893
      },
      "SQ3rules": {
        "FP": 58,
        "TP": 652,
        "auprc": 0.91,
        "coverage": 1.0,
        "f1": 0.906,
        "prec": 0.918,
        "rec": 0.893,
        "selective_risk": 0.156,
        "spec": 0.586
      },
      "SQ3strict": {
        "FP": 15,
        "TP": 652,
        "auprc": 0.963,
        "coverage": 1.0,
        "f1": 0.933,
        "prec": 0.978,
        "rec": 0.893,
        "selective_risk": 0.107,
        "spec": 0.893
      },
      "allSJ3": {
        "FP": 18,
        "TP": 730,
        "auprc": 0.976,
        "coverage": 1.0,
        "f1": 0.988,
        "prec": 0.976,
        "rec": 1.0,
        "selective_risk": 0.021,
        "spec": 0.871
      }
    },
    "sr_1000000": {
      "PIG": {
        "FP": 4,
        "TP": 398,
        "auprc": 0.969,
        "coverage": 0.545,
        "f1": 0.703,
        "prec": 0.99,
        "rec": 0.545,
        "selective_risk": 0.017,
        "spec": 0.971
      },
      "PIG+bam": {
        "FP": 4,
        "TP": 544,
        "auprc": 0.974,
        "coverage": 0.734,
        "f1": 0.851,
        "prec": 0.993,
        "rec": 0.745,
        "selective_risk": 0.019,
        "spec": 0.971
      },
      "SQ3ml": {
        "FP": 13,
        "TP": 214,
        "auprc": 0.926,
        "coverage": 1.0,
        "f1": 0.447,
        "prec": 0.943,
        "rec": 0.293,
        "selective_risk": 0.608,
        "spec": 0.907
      },
      "SQ3rules": {
        "FP": 58,
        "TP": 650,
        "auprc": 0.909,
        "coverage": 1.0,
        "f1": 0.904,
        "prec": 0.918,
        "rec": 0.89,
        "selective_risk": 0.159,
        "spec": 0.586
      },
      "SQ3strict": {
        "FP": 14,
        "TP": 613,
        "auprc": 0.955,
        "coverage": 1.0,
        "f1": 0.903,
        "prec": 0.978,
        "rec": 0.84,
        "selective_risk": 0.151,
        "spec": 0.9
      },
      "allSJ3": {
        "FP": 17,
        "TP": 690,
        "auprc": 0.968,
        "coverage": 1.0,
        "f1": 0.96,
        "prec": 0.976,
        "rec": 0.945,
        "selective_risk": 0.066,
        "spec": 0.879
      }
    },
    "sr_250000": {
      "PIG": {
        "FP": 4,
        "TP": 387,
        "auprc": 0.967,
        "coverage": 0.532,
        "f1": 0.69,
        "prec": 0.99,
        "rec": 0.53,
        "selective_risk": 0.017,
        "spec": 0.971
      },
      "PIG+bam": {
        "FP": 4,
        "TP": 533,
        "auprc": 0.973,
        "coverage": 0.723,
        "f1": 0.841,
        "prec": 0.993,
        "rec": 0.73,
        "selective_risk": 0.021,
        "spec": 0.971
      },
      "SQ3ml": {
        "FP": 13,
        "TP": 213,
        "auprc": 0.912,
        "coverage": 1.0,
        "f1": 0.446,
        "prec": 0.942,
        "rec": 0.292,
        "selective_risk": 0.609,
        "spec": 0.907
      },
      "SQ3rules": {
        "FP": 58,
        "TP": 649,
        "auprc": 0.909,
        "coverage": 1.0,
        "f1": 0.903,
        "prec": 0.918,
        "rec": 0.889,
        "selective_risk": 0.16,
        "spec": 0.586
      },
      "SQ3strict": {
        "FP": 14,
        "TP": 595,
        "auprc": 0.952,
        "coverage": 1.0,
        "f1": 0.889,
        "prec": 0.977,
        "rec": 0.815,
        "selective_risk": 0.171,
        "spec": 0.9
      },
      "allSJ3": {
        "FP": 17,
        "TP": 671,
        "auprc": 0.964,
        "coverage": 1.0,
        "f1": 0.946,
        "prec": 0.975,
        "rec": 0.919,
        "selective_risk": 0.087,
        "spec": 0.879
      }
    },
    "sr_4000000": {
      "PIG": {
        "FP": 4,
        "TP": 397,
        "auprc": 0.968,
        "coverage": 0.545,
        "f1": 0.702,
        "prec": 0.99,
        "rec": 0.544,
        "selective_risk": 0.019,
        "spec": 0.971
      },
      "PIG+bam": {
        "FP": 4,
        "TP": 542,
        "auprc": 0.974,
        "coverage": 0.733,
        "f1": 0.85,
        "prec": 0.993,
        "rec": 0.742,
        "selective_risk": 0.02,
        "spec": 0.971
      },
      "SQ3ml": {
        "FP": 12,
        "TP": 215,
        "auprc": 0.92,
        "coverage": 1.0,
        "f1": 0.449,
        "prec": 0.947,
        "rec": 0.295,
        "selective_risk": 0.606,
        "spec": 0.914
      },
      "SQ3rules": {
        "FP": 58,
        "TP": 650,
        "auprc": 0.909,
        "coverage": 1.0,
        "f1": 0.904,
        "prec": 0.918,
        "rec": 0.89,
        "selective_risk": 0.159,
        "spec": 0.586
      },
      "SQ3strict": {
        "FP": 14,
        "TP": 613,
        "auprc": 0.955,
        "coverage": 1.0,
        "f1": 0.903,
        "prec": 0.978,
        "rec": 0.84,
        "selective_risk": 0.151,
        "spec": 0.9
      },
      "allSJ3": {
        "FP": 17,
        "TP": 689,
        "auprc": 0.968,
        "coverage": 1.0,
        "f1": 0.96,
        "prec": 0.976,
        "rec": 0.944,
        "selective_risk": 0.067,
        "spec": 0.879
      }
    }
  },
  "notes": "Per setting: non-FSM genuine-vs-false metrics per method. allSJ3 = keep an isoform iff every junction has >= 3 unique short reads (SQANTI3 min_cov). SQ3strict = SQANTI3 rules filter with min_cov >= 3 required. SQ3ml uses SQANTI3's default TP/TN (FSM vs NNC) which is mismatched to this simulation (most NNC are genuine), so it is reported but not used for conclusions. Conclusion: PanIsoGuard is not more accurate than a one-line short-read rule; PIG+bam's small AUPRC gain is within the bootstrap CI at every depth since 0.0.6 (the BAM gate needs >= 3 spanning reads); with no short reads it is worse than the SQANTI3 rules filter.",
  "protocol": "sqanti3_filter_h2h",
  "ruleset_version": "builtin-0.0.5",
  "scope": "gencode_v49_chr22_sqanti_sim",
  "source": null,
  "status": "tracked",
  "tool_version": "0.0.6"
}
