{
  "command": "bash benchmark/sqanti_sim/run.sh && python3 benchmark/sqanti_sim/sweep.py $PIG --work benchmark/sqanti_sim/work --emit-metrics benchmark/results/sqanti_sim/metrics.json",
  "data_provenance": "SQANTI-SIM (gencode_v49_chr22); truth via run.sh (SQANTI-SIM/PBSIM3/FLAIR/SQANTI3)",
  "generated_utc": null,
  "metrics": {
    "auprc_baseline": 0.8314,
    "auprc_genuine": 0.9712,
    "nnc_recall": 1.0,
    "precision_genuine": 0.989,
    "recall_genuine": 0.589,
    "specificity_false": 0.966
  },
  "notes": "Operating point = config/rules.default.toml (default-0.0.1). Full grid in sweep.tsv.",
  "protocol": "sqanti_sim",
  "ruleset_version": "builtin-0.0.3",
  "scope": "gencode_v49_chr22",
  "source": null,
  "status": "tracked",
  "tool_version": "0.0.6"
}
